{
  "schemaVersion": 1,
  "generatedAt": "2026-09-02T18:00:00Z",
  "source": "hand-written worked example",
  "applications": [
    {
      "repository": "ATT-IDP5/platform-core",
      "project": "api-gateway",
      "kind": "service",
      "team": "platform",
      "description": "Public edge; routes to internal services.",
      "url": "https://gw.example.com",
      "dependsOn": ["ATT-IDP5/platform-core/auth-service", "ATT-IDP5/platform-core/user-service", "ATT-IDP5/platform-infra/feature-flags"],
      "attributes": { "language": "go", "tier": 1, "oncall": "#platform-oncall" }
    },
    {
      "repository": "ATT-IDP5/platform-core",
      "project": "auth-service",
      "kind": "service",
      "team": "platform",
      "dependsOn": ["external:postgres-main", "external:redis", "external:okta"],
      "attributes": { "language": "go", "tier": 1 }
    },
    {
      "repository": "ATT-IDP5/platform-core",
      "project": "user-service",
      "kind": "service",
      "team": "platform",
      "dependsOn": ["external:postgres-main"],
      "publishes": ["users.updated"],
      "attributes": { "language": "java", "tier": 1 }
    },
    {
      "repository": "ATT-IDP5/platform-core",
      "project": "notification-service",
      "kind": "service",
      "team": "growth",
      "subscribes": ["users.updated", "orders.placed"],
      "dependsOn": ["external:sendgrid"],
      "attributes": { "language": "node", "tier": 2, "sla": "99.5%" }
    },
    {
      "repository": "ATT-IDP5/platform-infra",
      "project": "feature-flags",
      "kind": "service",
      "team": "platform",
      "dependsOn": ["external:redis"],
      "attributes": { "language": "go", "tier": 2, "runtime": "k8s" }
    },
    {
      "repository": "ATT-IDP4/commerce",
      "project": "order-service",
      "kind": "service",
      "team": "commerce",
      "dependsOn": ["ATT-IDP5/platform-core/user-service", "external:postgres-main"],
      "publishes": ["orders.placed"],
      "attributes": { "language": "java", "tier": 1 }
    },
    {
      "repository": "ATT-IDP4/commerce",
      "project": "shared-models",
      "kind": "library",
      "team": "commerce",
      "description": "Shared DTOs. Cataloged for lookup; nothing depends on it at runtime."
    },
    {
      "repository": "ATT-IDP4/web",
      "project": "storefront",
      "kind": "web-app",
      "team": "web",
      "url": "https://shop.example.com",
      "dependsOn": ["ATT-IDP5/platform-core/api-gateway"],
      "attributes": { "language": "typescript", "framework": "nextjs", "tier": 1 }
    },
    {
      "repository": "ATT-IDP5/data",
      "project": "events-pipeline",
      "kind": "pipeline",
      "team": "data",
      "subscribes": ["orders.placed", "users.updated"],
      "dependsOn": ["external:s3-events"],
      "attributes": { "language": "python", "runtime": "airflow" }
    }
  ],
  "externals": [
    { "id": "postgres-main", "kind": "database", "name": "Postgres (main cluster)" },
    { "id": "redis", "kind": "cache" },
    { "id": "okta", "kind": "identity", "url": "https://example.okta.com" },
    { "id": "sendgrid", "kind": "saas" },
    { "id": "s3-events", "kind": "storage", "name": "S3 events bucket", "attributes": { "region": "us-east-1" } }
  ]
}
